{
  "provider": "Provider Name",
  "name": "Plan Name",
  "price": 0,
  "currency": "GBP",
  "data": "0GB",
  "minutes": "Unlimited",
  "texts": "Unlimited",
  "contractLength": "30 days",
  "status": "draft",
  "metadata": {
    "sourceUrl": "https://provider.com/plans",
    "confidence": "community",
    "notes": ""
  }
}
