{
  "provider": "Vodafone",
  "name": "Essentials",
  "price": 22,
  "currency": "GBP",
  "data": "100GB",
  "minutes": "Unlimited",
  "texts": "Unlimited",
  "contractLength": "30 days",
  "status": "complete",
  "metadata": {
    "sourceUrl": "https://vodafone.co.uk/plans",
    "confidence": "community",
    "notes": "Sample data for demonstration purposes"
  }
}
