{
  "provider": "EE",
  "name": "Essential Plan",
  "price": 20,
  "currency": "GBP",
  "data": "50GB",
  "minutes": "Unlimited",
  "texts": "Unlimited",
  "contractLength": "30 days",
  "status": "complete",
  "metadata": {
    "sourceUrl": "https://ee.co.uk/plans",
    "confidence": "community",
    "notes": "Sample data for demonstration purposes"
  }
}
